HotelName,Location,Price,Rating,DistanceFromCenter,RoomType,OriginalPrice,PricePerNight,Discount
Great View from 63th Floor! Amazing Pool with Burj View! Grande Signature!,Dubai,3408.0,9.2,20.0,Two-Bedroom Apartment,3408.0,852.0,0.0
Swissôtel Al Murooj Dubai,Trade Centre,1548.0,8.8,1.0,Classic King Room,1548.0,387.0,0.0
MAZMI CASA,Bur Dubai,1499.0,9.4,8.1,Deluxe Double or Twin Room with River View,1499.0,374.75,0.0
Frank Porter - Bayz Tower by Danube,Business Bay,591.0,6.4,1.7,Apartment,591.0,147.75,0.0
InterContinental Residence Suites Dubai Festival City by IHG,Dubai Festival City,1417.0,8.8,8.5,King Studio Suite,1417.0,354.25,0.0
Royal suites Dunya tower Burj Khalifa St Kings,Downtown Dubai,1619.0,9.2,1.1,Superior King Room,1619.0,404.75,0.0
DAMAC Maison Mall Street,Downtown Dubai,2749.0,9.0,1.2,One Bedroom City View King with kitchenette and Private Balcony,2749.0,687.25,0.0
Grandeur Hotel Al Barsha,Al Barsha,882.0,7.8,11.8,Executive Room,882.0,220.5,0.0
Avani Deira Dubai Hotel,Deira,1006.0,7.8,10.2,AVANI Room,1006.0,251.5,0.0
Classy 1BR at Bayz by Danube Business Bay by Deluxe Holiday Homes,Business Bay,1038.0,9.0,1.7,One-Bedroom Apartment,1038.0,259.5,0.0
White Sage Spacious 1BR at Marina Promenade,Dubai Marina,1059.0,9.4,19.4,One-Bedroom Apartment,1177.0,264.75,10.03
Mövenpick Grand Al Bustan,Garhoud,909.0,8.3,9.3,"Classic King Room, 20% off on F&B, Complimentary shuttle to Dubai Festival City Mall",3029.0,227.25,69.99
Hyatt Regency Creek Heights Residences,Bur Dubai,1634.0,8.9,6.7,Studio with Kitchen,1634.0,408.5,0.0
Mövenpick Hotel Apartments Al Mamzar Dubai,Deira,738.0,7.4,13.4,Superior King Room,738.0,184.5,0.0
"3BR with Gaming Lounge, Burj Khalifa, Fountain View",Downtown Dubai,4862.0,9.5,300.0,Three-Bedroom Apartment,5402.0,1215.5,10.0
Jannah Place Dubai Marina,Dubai Marina,1151.0,7.8,19.8,Studio Apartment,1151.0,287.75,0.0
Knight Armour Hotel,Deira,460.0,6.6,8.9,Deluxe Single Room with 20% discount on F&B,460.0,115.0,0.0
"Citadines Culture Village Dubai, Waterfront Jaddaf",Bur Dubai,899.0,8.7,7.5,Standard Room with and without Balcony (Main Road),899.0,224.75,0.0
La Quinta by Wyndham Dubai Jumeirah,Bur Dubai,813.0,7.9,6.1,"Deluxe Room, 2 Twin Beds - Complimentary Transfer to La Mer Beach, Dubai Mall / Burj Khalifa Metro Station",813.0,203.25,0.0
SIRO One Za'abeel,Trade Centre,2321.0,8.9,4.1,"SIRO Plus King, complimentary fitness class and nutrition consultation",2901.0,580.25,19.99
DoubleTree by Hilton Dubai Jumeirah Beach,Jumeirah Beach Residence,1748.0,8.5,20.0,One-Bedroom Suite - City View,1748.0,437.0,0.0
"Executive Studio at Upside Living, Business Travel Ready",Business Bay,1281.0,10.0,2.1,Studio,1281.0,320.25,0.0
Awesome Studio Apartment with Burj Khalifa View at Business Bay,Business Bay,753.0,10.0,1.7,Studio Apartment,753.0,188.25,0.0
Hyba Heritage Hotel,Deira,382.0,8.0,8.4,Deluxe Suite,382.0,95.5,0.0
"Radisson Blu Hotel, Dubai Deira Creek",Deira,1248.0,8.4,8.6,"Standard Room with Balcony and Creek View - includes Complimentary Shuttle to Kite Beach, Dubai Mall / Burj Khalifa",1248.0,312.0,0.0
The H Dubai,Trade Centre,1381.0,8.8,4.1,Deluxe Twin Room,1381.0,345.25,0.0
One bedroom apartment sea view partially,Jumeirah Beach Residence,1799.0,8.8,18.9,Apartment with Sea View,1799.0,449.75,0.0
"Beautiful 1BR Apartment at Wilton Park Residences, MBR by Deluxe Holiday Homes",Dubai,1383.0,8.8,4.3,One-Bedroom Apartment,1383.0,345.75,0.0
DAMAC Maison Canal Views,Business Bay,1889.0,9.3,1.4,Deluxe Room with kitchenette - City Skyline View,1889.0,472.25,0.0
"Azure - 1-Bed Luxury by Crystal Lagoon, Downtown",Dubai,723.0,9.3,2.9,One-Bedroom Apartment,723.0,180.75,0.0
Jumeirah Marsa Al Arab Dubai,Beach & Coast,7736.0,6.9,10.1,Marina Deluxe Room with Marina & Dubai Skyline View - includes Private Terrace (11 sqm),7736.0,1934.0,0.0
"Element Me'aisam, Dubai",Dubai Production City,750.0,8.8,19.0,"Studio Apartment – King Bed (Complimentary Breakfast & Shuttle to Sobha Realty Metro Station, JBR Beach & Mall of the Emirates)",750.0,187.5,0.0
Riviera Hotel,Deira,849.0,8.4,8.7,Standard Double Bed-Souk View with Balcony- Free Beach Transfer,1022.0,212.25,16.93
Best Western Plus Pearl Creek,Deira,587.0,7.5,8.7,Standard King Room,587.0,146.75,0.0
Elegant Studio w Balcony View near Downtown Dubai,Dubai,836.0,8.0,4.5,Studio,836.0,209.0,0.0
Retreat by Voye Homes inside Anantara with Resort Access & Private Beach in Palm Jumeirah,Palm Jumeirah,1469.0,8.5,14.2,One-Bedroom Apartment with Sea View and Balcony,1469.0,367.25,0.0
Millennium Lakeview Hotel Formerly Copthorne Lakeview Hotel,Dubai Investment Park,767.0,8.1,23.9,Superior King Room,767.0,191.75,0.0
Dubai Marine Beach Resort & Spa,Jumeirah,1180.0,8.4,4.4,Standard Room,1180.0,295.0,0.0
Urban Studio at The Address Residences Dubai Marina by Deluxe Holiday Homes,Dubai Marina,1184.0,10.0,18.7,Studio,1184.0,296.0,0.0
Al Manar Grand Hotel Apartment,Bur Dubai,525.0,7.9,6.4,Double Double Standard,525.0,131.25,0.0
Fairmont The Palm,Palm Jumeirah,2646.0,8.6,16.3,Fairmont Heritage King Room,2646.0,661.5,0.0
Atlantis The Royal,Palm Jumeirah,5258.0,9.2,16.0,Seascape King Room,5258.0,1314.5,0.0
Downtown Sky High Luxury Apartment I City And Sea Views I Opp Dubai Mall Burj Khalifa,Downtown Dubai,3549.0,8.7,300.0,Two-Bedroom Apartment,3549.0,887.25,0.0
Modern 1Br in the Heart of Dubai by SIMPLY COMFORT,Business Bay,2450.0,10.0,2.0,One-Bedroom Apartment,2450.0,612.5,0.0
XVA Art Hotel,Bur Dubai,769.0,8.8,8.1,Single Room,769.0,192.25,0.0
Large Studio Attached to Metro - Dubai Marina Diamond3,Dubai Marina,770.0,6.9,17.9,Studio Apartment with Balcony,770.0,192.5,0.0
Highest infinity Pool in Downtown Dubai,Business Bay,3027.0,8.9,0.8,Deluxe One-Bedroom Apartment,3027.0,756.75,0.0
Ibis Styles Dragon Mart Dubai,International City,417.0,7.7,15.0,Standard Twin Room,417.0,104.25,0.0
Alsahel Beach Holiday,Jumeirah Beach Residence,246.0,10.0,19.2,Single Bed in Dormitory Room,246.0,61.5,0.0
Unlock Waters Edge,Business Bay,1657.0,8.3,1.7,Studio with Canal View,1657.0,414.25,0.0
"Burj Crown - First Class Boulevard View, 9 min Walk Dubai Mall",Downtown Dubai,4101.0,9.1,250.0,Two-Bedroom Deluxe Apartment with Balcony,4101.0,1025.25,0.0
Majestic Cove Hotel - Formerly Le Méridien Fairway,Garhoud,1036.0,8.8,8.8,Deluxe King Room,1036.0,259.0,0.0
"Element Al Mina, Dubai Jumeirah",Bur Dubai,1136.0,8.6,6.1,Studio 1 King Bed - Complimentary Transfer to Dubai Mall / Burj Khalifa & DXB Airport Shuttle Drop Off,1136.0,284.0,0.0
Sea & Palm View 2BR JBR BeachGem,Jumeirah Beach Residence,4407.0,9.2,18.4,Two-Bedroom Apartment with Balcony and Sea View,4407.0,1101.75,0.0
Delano Dubai at Bluewaters,Beach & Coast,2911.0,8.9,19.7,Rising Light Twin Guest Room with Balcony and Resort View,2911.0,727.75,0.0
LUX 2BR close to Dubai Mall and Burj Khalifa,Downtown Dubai,6327.0,9.3,350.0,Two-Bedroom Apartment,6327.0,1581.75,0.0
Katkeys,Dubai,294.0,9.3,14.1,King Room with Balcony,368.0,73.5,20.11
Cozy 1-Bedroom Apartment at West Avenue Tower near Marina beach,Dubai Marina,1066.0,9.0,19.0,One-Bedroom Apartment,1066.0,266.5,0.0
New Fairmont Residence with private beach on PalmJumeirah,Palm Jumeirah,4915.0,9.0,16.2,Two-Bedroom Apartment with Balcony and Sea View,6143.0,1228.75,19.99
Luxury Business Bay Residence Z Tower,Business Bay,565.0,9.0,1.6,One-Bedroom Apartment,642.0,141.25,11.99
Brown Stone - Golf Course Dubai Cricket Stadium,Dubai,487.0,7.3,18.9,One-Bedroom House,487.0,121.75,0.0
City Seasons Hotel Dubai,Deira,725.0,8.0,9.2,Premium Twin Room,853.0,181.25,15.01
Royal Ascot Hotel,Bur Dubai,951.0,7.5,7.4,Superior Deluxe Room,951.0,237.75,0.0
Cozy Studio in JVC,Dubai,483.0,7.5,17.2,One-Bedroom Apartment,483.0,120.75,0.0
Majestic 1 Bedroom Flat Perfect for 4 in Marina,Dubai Marina,1129.0,8.4,19.0,Apartment,1129.0,282.25,0.0
Sonder at JBR The Walk,Jumeirah Beach Residence,2052.0,8.9,18.8,One-Bedroom Apartment with City View,2052.0,513.0,0.0
Magnificent 2BR in The Brand New The Diplomat,Dubai,1380.0,8.9,21.8,Apartment,1380.0,345.0,0.0
"Forte Tower - New Elite Opera View, Opposite Burj Khalifa and Dubai Mall",Downtown Dubai,6654.0,8.9,250.0,Deluxe Apartment,6654.0,1663.5,0.0
Dubai Marina larivera,Dubai Marina,3749.0,7.4,19.2,Two-Bedroom Apartment,3749.0,937.25,0.0
"Burj Crown - New Sky High, Near Burj Khalifa, Boulevard View, Opposite Dubai Mall",Downtown Dubai,5144.0,8.9,250.0,Deluxe Apartment,5144.0,1286.0,0.0
Hyatt Regency Dubai Creek Heights,Bur Dubai,1465.0,8.8,6.8,Deluxe King Room,1465.0,366.25,0.0
GLOBALSTAY J One Tower Apartments at Pearl of UAE,Business Bay,1684.0,7.8,1.5,Studio,1981.0,421.0,14.99
Jumeirah Living Marina Gate Dubai,Dubai Marina,1636.0,9.2,17.4,Executive Studio,1636.0,409.0,0.0
SIMPLY COMFORT Apartments at Nobles Tower Luxury Burj View,Business Bay,3991.0,9.6,2.1,Two-Bedroom Deluxe Apartment with Balcony,3991.0,997.75,0.0
"High-Rise Chic, Burj Crown, Opera Boulevard View, by Dubai Mall",Downtown Dubai,4142.0,8.6,300.0,Two-Bedroom Deluxe Apartment with Balcony,4142.0,1035.5,0.0
Studio in the heart of Sports City -great view & amenities!,Dubai,809.0,9.0,18.0,Studio Apartment,809.0,202.25,0.0
"Charming 1BR Apartment in Vera Tower, Business Bay by Deluxe Holiday Homes",Business Bay,921.0,9.0,1.4,One-Bedroom Apartment,921.0,230.25,0.0
Comfortable Studio Apartment for 4 in DIFC,Trade Centre,1066.0,9.0,1.6,Studio,1066.0,266.5,0.0
LUXE | 2BR | Burj Khalifa View | Dubai Mall Access,Zabeel,2988.0,9.0,1.1,Deluxe Apartment,2988.0,747.0,0.0
"Address Marina Mall Suites - Full Marina Views, Balcony, Kitchen & Parking",Dubai Marina,2213.0,7.2,18.7,Suite,2213.0,553.25,0.0
"Burj Khalifa Lake Vicinity Perfect 1BR Escape, Residences 7, Downtown Dubai by Deluxe Holiday Homes",Downtown Dubai,1233.0,9.0,400.0,One-Bedroom Apartment,1233.0,308.25,0.0
LUX 1BR Burj Khalifa and Fountain Views,Downtown Dubai,4781.0,9.5,350.0,One-Bedroom Apartment,4781.0,1195.25,0.0
"Lux Escape, Burj Crown Opera View, Near Dubai Mall",Downtown Dubai,4274.0,9.0,300.0,Two-Bedroom Deluxe Apartment with Balcony,4274.0,1068.5,0.0
TURQUOISE - Downtown Dubai 1 BEDROOM APARTMENT Business Bay - CANAL VIEW,Business Bay,934.0,8.4,1.4,One-Bedroom Apartment,934.0,233.5,0.0
"Charming 1BR Apartment in Sparkle Tower 1, Dubai Marina by Deluxe Holiday Homes",Dubai Marina,1757.0,8.4,19.7,One-Bedroom Apartment,1757.0,439.25,0.0
Address Beach Resort,Beach & Coast,4241.0,9.3,20.1,Deluxe Marina City View Room & World's Highest Infinity Pool Access,6058.0,1060.25,29.99
Nassima Tower Hotel Apartments,Trade Centre,1180.0,7.6,3.3,One-Bedroom Apartment,1180.0,295.0,0.0
"Charming Studio Apartment at Bay Square - 09, Business Bay by Deluxe Holiday Homes",Business Bay,937.0,7.6,1.4,Studio,937.0,234.25,0.0
Elegant 2 Bedroom Apartment in Sobha Hartland,Dubai,682.0,8.0,4.3,Two-Bedroom Apartment with Balcony,682.0,170.5,0.0
Burj Crown - Downtown Elegance Opera Boulevard View by Dubai Mall,Downtown Dubai,5314.0,8.8,250.0,Two-Bedroom Deluxe Apartment with Balcony,5314.0,1328.5,0.0
Jumeirah Beach Hotel Dubai,Umm Suqeim,2139.0,8.8,10.2,Ocean View Deluxe Room - includes Wild Wadi Waterpark™ and KiDS Club access,2139.0,534.75,0.0
3 Bed with Private Beach In Palm Jumeirah,Palm Jumeirah,5300.0,8.8,18.5,Three-Bedroom Apartment,6624.0,1325.0,19.99
Unbeatable Price Luxe 1BR in Prime Location by Deluxe Holiday Homes,Dubai Marina,1378.0,9.0,20.3,One-Bedroom Apartment,1378.0,344.5,0.0
Cozy urban stay near Dubai Mall,Dubai,744.0,10.0,4.9,One-Bedroom Apartment,744.0,186.0,0.0
Majestic Tower,Business Bay,787.0,10.0,1.5,One-Bedroom Apartment,787.0,196.75,0.0
Raffles The Palm,Palm Jumeirah,2414.0,9.0,18.9,Premier Ocean View Room With balcony,2414.0,603.5,0.0
"Beautiful 1BR Apartment in Harbour Gate 1, Dubai Creek Harbour by Deluxe Holiday Homes",Dubai Creek,1150.0,9.0,7.6,One-Bedroom Apartment,1150.0,287.5,0.0
Jumeirah Dar Al Masyaf Dubai,Al Sufouh,4464.0,9.3,11.3,Palm House Garden Room,4464.0,1116.0,0.0
Barceló Residences Dubai Marina,Dubai Marina,1519.0,8.4,18.1,Studio,1519.0,379.75,0.0
Lux Living on Palm Jumeirah With Pool & Beach Access,Palm Jumeirah,3806.0,6.7,16.1,Three-Bedroom Apartment,3806.0,951.5,0.0
Spacious Studio in Damac Maison Prive Canal Views,Business Bay,1265.0,9.0,1.2,One-Bedroom Apartment,1265.0,316.25,0.0
The Villa Jumeirah,Umm Suqeim,947.0,8.7,9.7,Studio with Garden View,947.0,236.75,0.0
Amazing 2 bedroom with full burj view,Downtown Dubai,5301.0,9.3,0.7,Two-Bedroom Apartment,5301.0,1325.25,0.0
Deluxe Villa Rooms in Dubai near Airport,Dubai,1799.0,7.9,17.1,King Room,1799.0,449.75,0.0
"La Buena Vida Holiday Homes - Exquisite Spacious Luxe 1BR Apt , Full Marina View, Kitchen, 5 Min to Beach, JBR and Marina",Dubai Marina,1717.0,9.5,19.6,One-Bedroom Deluxe Apartment,1717.0,429.25,0.0
Sofitel Dubai The Palm Resort & Spa,Palm Jumeirah,1965.0,8.6,15.4,Classic Room Courtyard View,1965.0,491.25,0.0
Bliss at the Fields,Dubai,4828.0,9.4,11.2,Villa,4828.0,1207.0,0.0
AlRaef Luxury Apartments,Deira,1988.0,6.4,12.0,One-Bedroom Premium Apartment,1988.0,497.0,0.0
White Sage - Premium Furnished Studio With Large Balcony,Business Bay,972.0,7.6,1.2,Studio,972.0,243.0,0.0
Elegant Villa Rooms in Dubai near Airport,Dubai,1799.0,7.5,17.1,King Room,1799.0,449.75,0.0
Al Ashrafia Saray - Extraordinary Studio in Canal View,Business Bay,939.0,7.5,1.4,One-Bedroom Apartment,939.0,234.75,0.0
Knokey Bay Square,Business Bay,852.0,9.0,1.4,One-Bedroom Apartment,852.0,213.0,0.0
Al Khoory Hotel Apartments Al Barsha,Al Barsha,798.0,8.6,12.2,Studio,798.0,199.5,0.0
Adagio Premium Dubai Al Barsha,Al Barsha,1006.0,8.3,12.5,One-Bedroom Apartment,1006.0,251.5,0.0
Upgraded Apartment with Stunning Burj Khalifa View,Downtown Dubai,4010.0,8.9,1.0,Two-Bedroom Apartment,4010.0,1002.5,0.0
Plush 1BR at Act One Act Two Tower 2 Downtown Dubai by Deluxe Holiday Homes,Downtown Dubai,1427.0,8.9,350.0,One-Bedroom Apartment,1427.0,356.75,0.0
Address Beach Residence,Jumeirah Beach Residence,13253.0,9.4,20.0,One-Bedroom Apartment,13253.0,3313.25,0.0
EasyGo - Azizi Riviera 15 Community View,Dubai,727.0,8.7,3.8,Studio with Balcony,727.0,181.75,0.0
Splendid Villa Rooms near Dubai Airport,Dubai,1893.0,6.5,14.2,King Room,1893.0,473.25,0.0
Frank Porter - 29 Boulevard,Downtown Dubai,1991.0,8.7,450.0,Apartment,1991.0,497.75,0.0
"Grosvenor House, a Luxury Collection Hotel, Dubai",Dubai Marina,1988.0,9.6,17.8,"Deluxe Room, With Complimentary Resort Beach & Pool Access, Guest room, 1 King",1988.0,497.0,0.0
SO/ Uptown Dubai,Dubai,1522.0,8.9,19.9,Collection King Room,1522.0,380.5,0.0
Splendid Apartments with Burj Khalifa and Fountain View,Downtown Dubai,5301.0,7.9,0.7,Three-Bedroom Apartment,5301.0,1325.25,0.0
"Cozy Apartment in JVC, Dubai",Dubai,871.0,9.0,16.8,One-Bedroom Apartment,871.0,217.75,0.0
Creek Beachfront Heaven: 1BR Luxe Harbor Flat,Dubai Creek,1470.0,10.0,7.7,One-Bedroom Apartment,1470.0,367.5,0.0
Vida Emirates Hills,Dubai,1248.0,9.1,17.4,City View Deluxe Room King,1560.0,312.0,20.0
SUHA Mina Rashid Hotel Apartments,Bur Dubai,789.0,8.6,6.7,Deluxe Studio,789.0,197.25,0.0
"Exclusive 1-BDR Stay - Zada Tower, Business Bay",Business Bay,628.0,8.6,1.6,One-Bedroom Apartment,628.0,157.0,0.0
Al Khoory Courtyard Hotel,Dubai,900.0,8.1,4.4,Superior Double or Twin Room,900.0,225.0,0.0
Luxury Studio - Downtown Dubai - Near Burj Khalifa,Business Bay,1460.0,10.0,1.2,One-Bedroom Apartment,1460.0,365.0,0.0
Luxe Comfort 1BR in Binghatti Venus-05,Dubai,920.0,10.0,17.6,One-Bedroom Standard Apartment,920.0,230.0,0.0
Welcoming Studio at Sky Gardens DIFC By Deluxe Holiday Homes,Zabeel,952.0,7.2,2.1,One-Bedroom Apartment,952.0,238.0,0.0
sand and beach haven at Ajman Corniche!,Dubai,1568.0,9.5,28.1,Two-Bedroom Apartment,1568.0,392.0,0.0
Peony Hotel,Dubai Investment Park,729.0,7.8,23.8,Double or Twin Room,729.0,182.25,0.0
"Chic 1BR in The Residence at Marina Gate 2, Dubai Marina by Deluxe Holiday Homes",Dubai Marina,1922.0,10.0,17.4,One-Bedroom Apartment,1922.0,480.5,0.0
Spacious Studio at Sky Gardens DIFC by Deluxe Holiday Homes,Zabeel,1016.0,10.0,2.1,Studio,1016.0,254.0,0.0
Jumeirah Al Naseem Dubai,Umm Suqeim,4888.0,9.1,10.8,Resort Deluxe & Wild Wadi Waterpark™ Access,4888.0,1222.0,0.0
Stunning 1 Bdr luxury residence at JVC,Dubai,1225.0,9.1,16.5,One-Bedroom Apartment,1225.0,306.25,0.0
Modern and Classic 1BDR In RP Heights Downtown,Downtown Dubai,804.0,5.0,1.2,One-Bedroom Apartment,804.0,201.0,0.0
Elite Byblos Hotel,Al Barsha,794.0,8.4,11.7,Classic King Room,794.0,198.5,0.0
Refined 1BR Retreat in The Point Tower - Marina,Dubai Marina,1129.0,8.4,19.6,Apartment,1129.0,282.25,0.0
Palazzo Versace Dubai,Bur Dubai,2857.0,8.8,7.8,Deluxe Versace Room with City View,2857.0,714.25,0.0
Holiday Inn Express Dubai Airport by IHG,Garhoud,806.0,8.1,10.2,Deluxe King Room - Non-Smoking,806.0,201.5,0.0
"Exclusive Studio at Sky Gardens, DIFC by Deluxe Holiday Homes",Zabeel,958.0,8.1,2.1,Studio,958.0,239.5,0.0
SUNRISE HOMES - Beautiful Marina Studio near JBR Beach,Dubai Marina,1108.0,8.0,17.8,One-Bedroom Apartment,1108.0,277.0,0.0
"Amwaj Rotana, Jumeirah Beach - Dubai",Jumeirah Beach Residence,1674.0,8.9,19.7,Newly Renovated - Sea View Room with Balcony - King Bed,1674.0,418.5,0.0
Palm Jumeirah - Luxe Infinity Pool I Direct Beach Access,Dubai,3994.0,8.9,16.3,One-Bedroom Superior Apartment,3994.0,998.5,0.0
Gulf Oasis Hotel Apartments Fz LLC,Barsha Heights (Tecom),899.0,8.2,14.8,Studio Apartment,899.0,224.75,0.0
Burj Khalifa view brand new luxury apartment Business Bay,Business Bay,942.0,8.2,2.1,Three-Bedroom Apartment,1108.0,235.5,14.98
Manzil - 1BR District One Residences with Beach & Lagoon Access,Dubai,1328.0,9.8,4.5,One-Bedroom Apartment,1328.0,332.0,0.0
ShoresInn - Waterfront in Heart of Dubai Marina,Dubai Marina,1539.0,9.0,18.6,One-Bedroom Apartment,1539.0,384.75,0.0
"Modern Studio, Burj Views - Business Travelers",Business Bay,1349.0,9.0,2.1,Queen Studio,1349.0,337.25,0.0
Fabulous 1-Bedroom Apartment Near JBR in Dubai Marina,Dubai Marina,1442.0,9.3,17.4,One-Bedroom Apartment,1442.0,360.5,0.0
Staycae Holiday Homes - Aykon C,Business Bay,1499.0,7.6,2.6,Studio,1499.0,374.75,0.0
Situated On the Famous JBR With Direct Beach Access,Jumeirah Beach Residence,1756.0,7.6,18.9,Apartment,1756.0,439.0,0.0
Delightful 2BR apartment at Reva Residences,Business Bay,2262.0,8.7,1.3,Two-Bedroom Apartment,2262.0,565.5,0.0
SUNRISE HOMES - Close to JBR Beach - Beautiful Studio,Dubai Marina,1063.0,9.4,17.9,One-Bedroom Apartment,1063.0,265.75,0.0
Emaar Residences Dubai Marina by Qstay - Address Dubai Marina,Dubai Marina,2702.0,8.2,18.7,Studio with Balcony,2702.0,675.5,0.0
Al Manara Luxury Maison Suite 1BR Near Jumeirah Beach,Beach & Coast,899.0,8.2,7.8,One-Bedroom Apartment,899.0,224.75,0.0
Exclusive Rate 1BR with Partial Burj Khalifa Views by Deluxe Holiday Homes,Business Bay,1020.0,8.2,1.3,One-Bedroom Apartment,1020.0,255.0,0.0
Palace Dubai Creek Harbour,Dubai Creek,1810.0,9.3,7.6,Deluxe Room King - Complimentary Lagoon Access,2414.0,452.5,25.02
PineaPPLe XPress,Dubai Marina,806.0,7.3,17.2,Deluxe Double Room with Side Sea View,806.0,201.5,0.0
Horizon Rooms JBR,Jumeirah Beach Residence,417.0,9.2,18.4,Single Room with Shared Bathroom,417.0,104.25,0.0
"Four Points by Sheraton Production City, Dubai",Dubai Production City,746.0,8.7,19.7,"Standard King Bed, (Comp. Shuttle to DMCC Metro, Marina Mall & JBR, 20% off on F&B outlet)",746.0,186.5,0.0
VOGO Grand Hotel Formerly Best Western Plus Hotel Dubai Academic City,Dubai,503.0,7.6,16.9,Standard Single Room Non Smoking,503.0,125.75,0.0
Knight Castle Hotel - Formerly known as Carlton Palace Hotel,Deira,1227.0,7.0,8.8,Superior Double or Twin Room with 20% discount on F&B,1227.0,306.75,0.0
Sonder Downtown Towers,Al Satwa,1636.0,8.5,1.4,Two-Bedroom Apartment with Balcony,1636.0,409.0,0.0
Al Jaddaf Rotana Suite Hotel,Bur Dubai,1420.0,9.0,6.3,Twin Bed Room - City View,1420.0,355.0,0.0
"Downtown Views 1BR - Dubai Mall, Fountain & Burj Khalifa access",Zabeel,2017.0,10.0,1.2,One-Bedroom Apartment,2017.0,504.25,0.0
The Star @ JW Marriott Marina,Dubai Marina,2461.0,8.8,18.7,One-Bedroom Apartment,2461.0,615.25,0.0
bnbmehomes - Palm Views,Palm Jumeirah,1126.0,7.1,16.4,Studio with Sea View,1443.0,281.5,21.97
Ramada by Wyndham Dubai Deira,Deira,1253.0,7.9,9.7,"Queen Room - Non-Smoking, 20% off F&B",1253.0,313.25,0.0
Oaks Liwa Heights Hotel Suites,Jumeirah Lakes Towers,1259.0,8.7,18.0,Premier One-Bedroom Suite,1259.0,314.75,0.0
GOLD SKY AVENUE HOTEL,Deira,488.0,7.0,8.8,Standard Double Room,488.0,122.0,0.0
Contemporary design apartment,Dubai Creek,1175.0,7.0,7.5,Apartment,1175.0,293.75,0.0
Regal Studio at The Address Residences Dubai Marina by Deluxe Holiday Homes,Dubai Marina,1166.0,8.5,18.7,One-Bedroom Apartment,1166.0,291.5,0.0
Meliá Desert Palm Member of Meliá Collection,International City,1545.0,9.2,17.8,Palm Deluxe Room,1931.0,386.25,19.99
DAMAC Canal Views Residences,Business Bay,1374.0,7.5,1.4,One-Bedroom Suite with City View,1374.0,343.5,0.0
City Avenue Al Reqqa Hotel,Deira,757.0,8.1,9.0,Standard Double or Twin Room,757.0,189.25,0.0
A Fabulous 1 Bedroom Apartment in Marina Pinnacle,Dubai Marina,1192.0,9.7,17.2,One-Bedroom Apartment,1192.0,298.0,0.0
Winds of the Canal by Lagom - Business Bay Dubai,Business Bay,1194.0,8.0,1.2,Studio Apartment,1194.0,298.5,0.0
Exclusive GLOBALSTAY Apartments in Business Bay Free Parking & More!,Business Bay,1423.0,8.5,1.7,Studio Apartment,1674.0,355.75,14.99
Snug Studio at Upside Living - Business Travel Ready 2209,Business Bay,1282.0,8.5,2.0,Deluxe Queen Studio,1282.0,320.5,0.0
"High-Rise 1BR with Community View and Large Balcony Near the Parks, Binghatti Amber, Jumeirah Village Circle by Deluxe Holiday Homes",Dubai,1090.0,8.5,16.1,One-Bedroom Apartment,1090.0,272.5,0.0
Chic 1BR at The Signature Downtown Dubai by Deluxe Holiday Homes,Downtown Dubai,1238.0,8.5,1.1,One-Bedroom Apartment,1238.0,309.5,0.0
Peaceful 2 Bed Oasis Suite in JVC,Dubai,1250.0,8.5,18.0,Two-Bedroom Apartment,1250.0,312.5,0.0
Silkhaus contemporary 1BDR with Downtown view in DIFC,Trade Centre,2254.0,8.6,1.5,Apartment,2254.0,563.5,0.0
Deal of the Week Stylish 1BR with Partial Burj Views by Deluxe Holiday Homes,Business Bay,1126.0,7.0,1.7,One-Bedroom Apartment,1126.0,281.5,0.0
"Luxury 1br Apt, Ultimate Comfort & Great Location",Dubai Marina,1202.0,9.3,18.2,One-Bedroom Apartment,1202.0,300.5,0.0
Luxury Modern Apt in Dubai Marina - Close to Metro,Dubai Marina,1076.0,8.6,18.0,One-Bedroom Apartment,1076.0,269.0,0.0
Majestic City Retreat Hotel,Bur Dubai,816.0,7.9,6.8,Economy Double or Twin Room,816.0,204.0,0.0
"Jubilant Studio at Sky Gardens, DIFC by Deluxe Holiday Homes",Zabeel,967.0,7.9,2.1,Studio,967.0,241.75,0.0
Executive Studio at Upside Living with Burj Views 2805,Business Bay,1281.0,6.0,2.1,Deluxe Queen Studio,1281.0,320.25,0.0
Rose Plaza Hotel Al Barsha,Al Barsha,790.0,8.4,11.4,Classic King Room - Late check-out 2 pm,790.0,197.5,0.0
Calm Studio at Sky Gardens DIFC by Deluxe Holiday Homes,Zabeel,952.0,7.0,2.1,Studio,952.0,238.0,0.0
Fairmont Dubai,Trade Centre,1843.0,8.5,3.6,King Room,1843.0,460.75,0.0
Airy Studio at Sky Gardens DIFC by Deluxe Holiday Homes,Zabeel,958.0,7.5,2.1,Studio,958.0,239.5,0.0
Hues Boutique Hotel,Deira,631.0,7.0,10.5,Classic Room,631.0,157.75,0.0
Breathtaking Sea and Palm View Spacious Studio with Vibrant Vibes in JBR By SWEET HOMES,Jumeirah Beach Residence,1319.0,9.5,18.4,One-Bedroom Apartment,1319.0,329.75,0.0
Burj Khalifa View 1 Bedroom Apartment With Balcony For Up To 4 Person,Business Bay,2194.0,9.4,1.4,One-Bedroom Apartment,2926.0,548.5,25.02
MENA Plaza Hotel Albarsha At The Mall,Al Barsha,682.0,8.6,11.5,"Deluxe King Smoking Room - 20% off F&B, Laundry and Spa",682.0,170.5,0.0
"Mandarin Oriental Jumeira, Dubai",Jumeirah,4847.0,9.1,3.3,Superior King Room,4847.0,1211.75,0.0
Ivory Grand Hotel Apartments,Al Barsha,744.0,7.6,11.5,Studio,744.0,186.0,0.0
"1BR Apartment in Business Bay, Aykon City",Business Bay,1430.0,9.5,2.7,One-Bedroom Apartment,1430.0,357.5,0.0
SUNRISE HOMES - A Modern Studio near JBR Beach,Dubai Marina,1162.0,9.5,18.0,Queen Studio,1162.0,290.5,0.0
Chic Studio in The Address Residence Dubai Marina by Deluxe Holiday Homes,Dubai Marina,1175.0,9.0,18.7,Studio,1175.0,293.75,0.0
Silkhaus palm view 1BDR with private beach in Emaar Beachfront,Palm Jumeirah,1692.0,7.8,17.3,Apartment,1692.0,423.0,0.0
"Iconic Living - 2BR Apartment in Cayan Tower, Dubai Marina",Dubai Marina,1100.0,9.0,17.6,Two-Bedroom Standard Apartment,1100.0,275.0,0.0
Luxury Studio Apartments Business Bay With Balcony and Free parking by Belvilla,Business Bay,323.0,1.0,1.9,One-Bedroom House,577.0,80.75,44.02
Waldorf Astoria Dubai International Financial Centre,Trade Centre,2818.0,9.4,2.0,Deluxe King Room,2818.0,704.5,0.0
Holiday Inn & Suites - Dubai Science Park by IHG,Al Barsha,648.0,8.8,13.5,Standard King Room,648.0,162.0,0.0
Luxurious one bedroom Apartment with Burj Khalifa View,Downtown Dubai,1610.0,9.9,400.0,One-Bedroom Apartment,1610.0,402.5,0.0
Contemporary 1BR at Vera Tower Business Bay by Deluxe Holiday Homes,Business Bay,931.0,6.0,1.4,One-Bedroom Apartment,931.0,232.75,0.0
Special Offer Stylish 1BR with Pool & City Views by Deluxe Holiday Homes,Zabeel,967.0,6.8,2.1,Studio,967.0,241.75,0.0
Tranquil Studio at The Anwa By Omniyat Dubai Maritime City by Deluxe Holiday Homes,Bur Dubai,847.0,8.1,8.3,Studio,847.0,211.75,0.0
Stylish 1BD in Al Barsha w/ Great View and Jacuzzi,Al Barsha,843.0,8.1,14.1,One-Bedroom Apartment,843.0,210.75,0.0
Trendy 1-Bedroom Apartment for 4 in Business Bay,Business Bay,1129.0,10.0,1.9,One-Bedroom Apartment,1129.0,282.25,0.0
Luxury 1 Bedroom On Marina Walk,Dubai Marina,1665.0,9.5,19.5,One-Bedroom Apartment,1665.0,416.25,0.0
Frank Porter - Marina Views T1,Dubai Marina,1197.0,9.0,18.4,Studio,1197.0,299.25,0.0
Nas House Private Villas,Al Barsha,1591.0,8.7,11.9,Twin Room with Shared Bathroom,1591.0,397.75,0.0
